{
  "schema_version": 1,
  "request_id": "stock-dairy-discovery-close-20261029-170241-et-01",
  "requested_at": "2026-10-29T21:08:55.007Z",
  "trade_date": "2026-10-29",
  "stage": "close",
  "request_purpose": "opportunity_discovery",
  "research_repository": "yuatom/stock-dairy",
  "research_repository_commit_sha": "68b63f6e8c322a82a3137c20c25692d7368f31cf",
  "market_data_contract_sha": "0e068caada01c8a933b12fc2579d7a4fa06029c5",
  "candidate_symbols": [
    "F",
    "LLY",
    "CAT",
    "FTNT",
    "NOW",
    "MRVL"
  ],
  "transaction_id": "close-20261029-170241-et-01",
  "personal_state_proof": {
    "dynamic_state_read_sha": "6e1f8156213ccc696ec5417371971ae86feac5bc",
    "blob_sha": "0392a34c368b90447732aa690ca807321adfcddb",
    "state_version": 5,
    "authority_state": "canonical",
    "content_hash_status": "unavailable_no_script",
    "content_sha256": null
  },
  "research_universe_resolution_status": "resolved"
}
